Sno.,Requirements,Multi_Class,NewClass
665,system shall implement policy on technical issue like renewal of certificate and lost eids to cater for all eventuality,Functionality,SR
666,system shall learn how spam and good email look like for future classification through use if machine learning algorithm,Functionality,SR
667,system shall be able to send an sm and an email to security when detected face is not in systemâs database,Functionality,SR
668,quantity of word that user alter affect product accuracy when it come to word addition and update though,Accuracy,SR
669,system shall be capable of producing accurate result through reduced margin of false negative and false positive,Performance,SR
670,system shall ensure that interface is userfriendly to avoid human error credited to poor user interface quality,Usability,SR
671,system find indicator pattern attribute of or to exploit vulnerability known to exist in detected service software version,IntrusionD,SR
672,system will employ encryption at database side and use http when accessing networked resource over internet,Confidentiality,SR
673,this architecture also permit multiple client to access shared resource and service facilitating data and information sharing across multiple device and user,Feasibility,SR
674,proposed scheme for app is to make sound detection operation light weight and faster,Performance,SR
675,system should be easy to maintain such that module should easily interact effectively and in case of failure reinitialization of program is recommended,Maintainability,SR
676,system shall be able to enable payment which will have factor authentication static password and otp,Authentication,SR
677,system shall analyse caught activity check for any approved utilisation and afterwards give warning to framework head by transferring data on web,Functionality,SR
678,system should be reliable under all given condition and all module should work simultaneously without interfering each others performance,Reliability,SR
679,dispute system must prevent user from accessing any dispute case that do not belong to their cardholder base,Functionality,SR
680,tensorflow library will be used object detection api for conversion of sign language into text,Functionality,SR
681,system will have very low false negative rate which mean it be able to detect an actual vulnerability when it exists,Immunity,SR
682,system shall minimize access to system at police side to only authorized police officer,Usability,SR
683,system shall let existing customer log into website with their email address and password in under second,Performance,SR
684,static attribute of system predict potential operational performance bottleneck and future scalability problem early to allow for correction early,Survivability,SR
685,âfirst stepâ should provide safety of information and ensure that no loss of data occurs data is very crucial and loss is extremely damaging,Confidentiality,SR
686,once permission is granted clicking on âuploadââ button will lead to storage file where user will be able to select txt file,Functionality,SR
687,system component are not going to be degraded by weather change such heat or humidity even casing will be designed to suit prevailing weather condition,Immunity,SR
688,performance requirement of system is one of main nfrs of smart campus system project is going to work on facial recognition system and number plate reading,Performance,SR
689,system can be used in other platform such switching circuit or concerted to home security,Portability,SR
690,systemâs ability to produce trimmed output will deprive an attacker pirate access to single complete song file from any point onwards,Immunity,SR
691,waiter password used for tablet login must be changed every three month,Confidentiality,SR
692,all password that are generated or accepted must be stored in database in an encrypted form,Confidentiality,SR
693,system shall be detecting denial of service attack to include service overload broadcast storm and also message flooding,IntrusionD,SR
694,when both player have positioned their ship on their defensive grid product shall define status of each player for first turn,Functionality,SR
695,backup is enabled for application if user upgrade to new androidpowered device application restores userâs previous data when application is logged in,Confidentiality,SR
696,system shall enable user interaction to move to spam blacklisting and move to ham folder whitelisting,Performance,SR
697,system shall be capable of restoring itself to it previous state in event of failure eg system crash or power loss,Fault Tolerance,SR
698,application shall match color of schema set forth by department of homeland security,User-Friendly,SR
699,system shall ensure good performance and resource behaviour by measuring static quality attribute of application to predict potential operational performance bottleneck and future scalability problem,Performance,SR
700,system shall ensure easy maintainability by enforcing best practice in documentation applying complexity avoidance strategy and following basic programming practice,Maintainability,SR
701,once cxr image is acquired it will be used input to deep learning model for tb detection,Functionality,SR
702,system shall employ encryption technics at database side and use http when accessing networked resource over internet,Confidentiality,SR
703,commissioner will be only authorized user per league to adjust league setting,Confidentiality,SR
704,system maintainability shall be implemented through use of proper coding principle and practice such putting comment in proper organized and standard manner in program,Maintainability,SR
705,player will hide trimmed file from any direct contact with user or attacker thereby reliably depriving any illegal sharing of file,Confidentiality,SR
706,user and admin if logged in must be able to view trend and graph pertaining to user activity and type of anomaly occuring by day and time,Functionality,SR
707,system should have access control mechanism that take into account use of password and individual access right,Authorization,SR
708,if lead score fall within medium average then it will be set for manual verification by an enrollment coordinator through eleads system,Functionality,SR
709,response to user error and undesirable situation have been taken care of to ensure that application run without any uncertainty,Reliability,SR
710,system shall be able to lift barricade servomotor once an authorized vehicle try to enter designated area,Functionality,SR
711,web interface should be compatible with standard in order to be usable via all major web browser in wide variety of environment,Portability,SR
712,only user who have been authorized for home access to corporate intranet may use co from noncompany location,Confidentiality,SR
713,system should preserve userâs privacy by not publishing monitored network traffic and not exposing userâs registered email address,Confidentiality,SR
714,app support insertion point encoding allowing user to obfuscate their payload to avoid detection,Functionality,SR
715,software system need robust security mechanism in place so that unauthorized user are not allowed access to part of system,Confidentiality,SR
716,system shall give user an option to reset forgotten password of an existing username by email,Authentication,SR
717,application is accurate enough in counting object even in challenging lighting when object are partially obscured,Accuracy,SR
718,retinadoc is consultation app which is not substitute to any kind of treatment thereby reducing loss damage and harm resulting from use of product,Confidentiality,SR
719,system embedding module well scanning tool will offer relatively good performance and resource behaviour due to implemented design which have efficiency in mind,Performance,SR
720,waiter password used for tablet login must have bitstrength of at least bit,Confidentiality,SR
721,system should offer secure single signon platform which will give access to different application that user is entitled to access,Authorization,SR
722,each user is to be configured with unique user name and password that can be changed when it is necessary,Authentication,SR
723,system shall optionally allow user to destroy suspectâs detail file or save them for future record in secure database,Functionality,SR
724,system shall ensure that embedding module well scanning tool will offer relatively good performance and resource behaviour due to design implemented with efficiency in mind,Performance,SR
725,system will develop security system that will reduce to minimum possibility of corruption from system andor human,Confidentiality,SR
726,system shall not experience slowdown during inputoutput and computationally intensive task such encryption and embedding or extraction,Performance,SR
727,using payload generated through ra attacker can exploit entire network to monitor network traffic and control it to modify packet moving through it,Functionality,SR
728,system should also be able to notify user if there is any change in condition ie drop or rise that is any anomaly should be notified to user of system,Functionality,SR
729,use of sl ha no harm nor doe it have any possibility of loss or damage to data of any external device connected to same wifi router,Confidentiality,SR
730,system database should be backed up continuously at least once every for hour in order to minimize data loss in case of catastrophic failure,Survivability,SR
731,system shall enable retrieval of watermark from image and displaying similarity of original image and watermarked image,Functionality,SR
732,responsible for contacting bank for validation of ac number provided by customer while purchasing and make transaction from given ac,Functionality,SR
733,analyzer are responsible for analyzing data collected by sensor and identifying potential security threat,Functionality,SR
734,system shall enable sorting of spam to usersâ junk email folder reporting mail archiving monitoring and pop downloading,Performance,SR
735,system shall detect instruction based on their signature and classify them according to severity,Functionality,SR
736,system shall be put under several test such stress testing such that there will be no error in verifying user,Performance,SR
737,system mailbox is responsible for displaying email of logged in user well all spam email and it will have dashboard to navigate through email,Functionality,SR
738,product shall protect identity of player product shall provide player no access to information that might reveal identity of another player,Performance,SR
739,system shall provide authentication by ensuring that agent compare watermark key on detected image with key already stored in agencyâs database,Authentication,SR
740,recommendation feature is one of core of system after identification of user emotional recommender ha to play it part in suggesting motivational thought tip exercise and meditation,Functionality,SR
741,system shall show report containing detailed result found in file submitted for analysis and will clearly indicate which file is malicious and which one is benign,IntrusionD,SR
742,product must be designed using design pattern and coding best practice of maintenance software developer are able to integrate new functionality into product with working day,Maintainability,SR
743,system shall enable implementation of clear secure data exchange protocol and document interface and protocol being utilized,Confidentiality,SR
744,decomposition of email control and detection engine into smaller module and component allows for more manageable and maintainable system,Maintainability,SR
745,system implement pdp scheme which allows user to audit and check if untrusted server or an adversary did not compromise integrity of uploaded data,Auditing,SR
746,system function an idsipd and aid in relieving traffic targeting server if distributed do attack occurs and server is flooded with request,IntrusionD,SR
747,list of dispute case that are displayed after search is performed must be color coded for easy identification of dispute case based upon dispute case status,Usability,SR
748,systemâs classification process shall be developed with dependability in mind so to produce accurate result through reduced margin of false negative and false positive,Performance,SR
749,product shall end game when hit by offensive player result in sinking last of defensive player ship which had not been previously marked sunk,Functionality,SR
750,maintenance release will be offered to customer once year release shall take no longer than minute for of customer base to install,Maintainability,SR
751,product shall be robustthe product shall have fault avoidance based on standard adoption,Fault Tolerance,SR
752,system shall allow user to log into or own account providing or own email address and password,Authentication,SR
753,system will be able to detect whether student in smoking or not if smoking system will generate warning to notify authority and will impose fine on student,Functionality,SR
754,system shall allow message digest message signature to be transmitted to recipient via email,Functionality,SR
755,to avoid any potential misuse or invasion of privacy it is crucial to stress that preservation and use of such information should be done in compliance with ethical and legal standard,Confidentiality,SR
756,system shall provide verification procedure where administrator will try to make contact with specific bus in order to verify whether an accident ha indeed taken place and level of response required,Functionality,SR
757,system shall be up and running all time since it checking or monitoring childâs behavior and prevent any medium from being sent or received using bluetooth,Availability,SR
758,system shall monitor cpu usage to detect spike in cpu usage caused by cryptojacking by constantly reading computerâs current cpu utilization percentage and compare it to cpu usage baseline and detect extreme spike or deviation from usual cpu usage baseline due to cryptojacking activity,IntrusionD,SR
759,system shall allow network traffic monitoring in realtime by capturing incoming and outgoing tcp http and tl web traffic in order to correlate it with configured cryptojacking blacklist,IntrusionD,SR
760,system doe not use much hardware and software hence it is not costly to maintain system and system doe not require maintenance regularly,Maintainability,SR
761,system ha got an audit or logging mechanism which enables user to check and view if there were other malicious activity that have been happening when after they logged out of system,Auditing,SR
762,system should allow use of strong password and different viewing level to control access to data to reduce unauthorized access to data,Authorization,SR
763,every user of software is provided unique login id and password which is stored in database hashed by sha algorithm,Confidentiality,SR
764,project utilizes rabbitmq reliable and efficient message broker that enables efficient routing and delivery of message between different application,Reliability,SR
765,system is dependable it is developed using highlevel language modern classifier and advanced datasets to detects spam but also reduces false negative,Performance,SR
766,dispute system must prevent external user from requesting original receipt request for original receipt are restricted to internal user,Functionality,SR
767,this system will be easy to maintain it will be deployed with documentation associated with it including code snippet which allows project to be transferable to another maintenance or updating,Maintainability,SR
768,system shall collect and analyse data that child is typing and if it capture certain keywords or continuous sequence of expletive it should send an alert through text to parent,Auditing,SR
769,user and admin if not blocked by system must be able to recover and then change password by answering secret question,Functionality,SR
770,system will have very low false positive rate so that it can correctly identify false positive call and differentiate them from real vulnerability one,Immunity,SR
771,coc is maintained by po that hand over evidence to holder and feed credential of evidence holder in case detail,Functionality,SR
772,system shall provide user with an interactive email client that will allow them to send receive and archive email with destiny folder that will separate legitimate email and illegitimate email,Functionality,SR
773,system shall collect suspicious traffic and ancillary information describes or characterizes traffic identifying distinct network connection or association connectionless traffic and including enough detail to assist criminal investigation and prosecution,Functionality,SR
774,system shall be able to collect and analyse data that child is typing and if it capture certain keywords or continuous sequence of expletive it should send an alert through text to parentâs smartphone,Functionality,SR
775,user and admin if logged into system must be able to set secret question and it answer contingency in case they forget password,Functionality,SR
776,system guarantee reliability and availability because tool used in developing system apache kafka and apache storm allows system to be resilient to failure and to be available all time,Availability,SR
777,system shall enable specific log from computer to be captured and faultlessly interfaced with webbased application with help of security mechanism including hmac and pgp,Auditing,SR
778,utilizing aiml technique and data set email control and detection engine classifies and score email based on their potential spamming nature,Functionality,SR
779,system is lightweight app which ha all algorithm and library engraved within itself for easy management of information which that app would be working with thus making it maintenance easy and simple,Maintainability,SR
780,system shall be able to ensure information provided include unique username password and some personal detail which are needed to verify that user is eligible to create an account,Authentication,SR
781,user and admin if registered must be able to enter their name id along with their password and authenticates themselves to enter system,Functionality,SR
782,retinadoc doe not have any kind of thirdparty security requirement yet any type of user can use it without any additional privilege,Confidentiality,SR
783,system shall allow user to set an emailchange password so that it will subsequently be requested when attempting to change set userâs email address,Authentication,SR
784,system shall allow whistleblower to send message digest message m signature using mobile phone to zimbabwe anticorruption commission,Functionality,SR
785,system shall allow whistleblower to send message digest message m signature using mobile phone to zimbabwe anticorruption commission,Functionality,SR
786,reliability of overall program depends on reliability of separate component main pillar of reliability of system is backup of database which is continuously maintained and updated to reflect most recent change,Fault Tolerance,SR
787,system isaas will have scalable speed to meet response time and performance target and it should be able to serve detection concurrently without any delay or unrealistic waiting time for response,Performance,SR
788,three option are provided here which are main feature of our app ie fake content detection toxic content detectionvoice cloning,Functionality,SR
789,system shall never display userâs password it shall always be echoed with special character representing typed character,Confidentiality,SR
790,only authorized user shall access rf system only user that exist in uas system with rf system assigned to their role shall access rf system and use it,Confidentiality,SR
791,dispute system shall accurately provide list of possible reason code for given transaction list of possible reason code must be derived based on type of transaction and industry that merchant belongs to according to business rule defined for dispute system,Functionality,SR
792,each team owner will need to use username and password in order to be authenticated to reach team owner page,Confidentiality,SR
793,product shall be updated on regular basisthe product will have new major feature introduced every six month and quarterly maintenance release every six month,Maintainability,SR
794,product shall provide dynamic change support and transparent resource additionthe product shall support transparent resource addition and dynamic change support to provide scalability and avoid service interruption of more than day,Performance,SR
795,system shall allow to create and enforce secure coding practice through strictly identifying source of required data identifying data item and data structure required for exchange,Functionality,SR
796,customer web browser shall never display customer password it shall always be echoed with special character representing typed character,Confidentiality,SR
797,system shall be able to create and enforce secure coding practice throughout development by strictly identifying originator of data that is required recognizing data item and data structure that are necessary for exchange,Functionality,SR
798,dispute application shall be available xx with exception of following scheduled maintenance window monday saturday am to am est sunday amd to am est,Operational,SR
799,system shall provide invisible digital watermarking devised with use of discrete cosine transformation which encompasses factor of complex computation and robustness,Functionality,SR
800,system shall enable verifying of signature using group public key so that it will be convinced that it actually came from organization without knowledge of actual singer,Authentication,SR
801,system shall allow recipient to verify signature using group public key so that they will be convinced that it actually came from organisation without knowledge of actual signer,Authentication,SR
802,system shall allow user to answer question on their profile after they are requested to fill in question at registration which will be used challenge question when password is forgotten,Authentication,SR
803,system shall allow zimbabwe anticorruption commission to verify signature using group public key so that it will be convinced that it actually came from organisation without knowledge of actual signer,Authentication,SR
804,product must comply with intranet page standard and requirement of enet security of product look feel will be approved by architecture group prior to implementation remaining will be corrected and approved within one month of product release,User-Friendly,SR
805,zimbabwe anticorruption commission then verifies signature using group public key so that it will be convinced that it actually came from organisation without knowledge of actual signer,Authentication,SR
806,user access should be limited to permission granted to their role each level in pcg hierarchy will be assigned role and user will be assigned to these role access to functionality within rf system is dependent on privilegespermission assigned to role,Confidentiality,SR
807,system shall provide authentication service which is tested when logging into django admin panel backend of system when user log into system by entering username and password created by entering command prompt when running manage code,Authentication,SR
808,dispute system shall allow user to create or initiate chargeback request system must prompt user to enter required information to initiate chargeback request chargeback request result in printed chargeback notification that is sent to merchant indicating that their account will be charged back if no proof is provided that disputed transaction is valid,Functionality,SR
809,system is easy to maintain it can easily be integrated with other system modified or reused on other different platform,Maintainability,SR
810,web interface is done using cs and bootstrap which make it possible to use system on mobile phone,Functionality,SR
811,system shall meet userâs need regarding ease of entry ease of learning ease of handling likability and possible metric usability,Usability,SR
812,system is developed using python programming which is platform independent meaning that it can be deployed used on any platform be it window linux or mac o,Portability,SR
813,pc will be used to run android forensics suite and android device will be connected to this pc using usb cable,Functionality,NSR
814,application will give user an array of tool that will allow for different type of data acquisition depending on choice eg call log sm message hardware detail etc,Functionality,NSR
815,relevant feature or characteristic of sign language gesture are extracted from preprocessed video data,Functionality,NSR
816,application will also give functionality to user to decode application data of certain application which are to be specified later,Functionality,NSR
817,slr application may also include feedback mechanism that allow user,Functionality,NSR
818,we are generating transcript using kaldis artificial speech and acoustic model,Functionality,NSR
819,web application should have unique and recognizable brand identity that reflects purpose of application,Functionality,NSR
820,system will display recognized sign language gesture in graphical format,Functionality,NSR
821,after sign language gesture are recognized next step is to convert them into text or speech output,Functionality,NSR
822,system shall allow user to delete email,Functionality,NSR
823,system shall allow user to check new email,Functionality,NSR
