Sno.,Requirements,Multi_Class,NewClass
1290,system executable shall be deployable on any platform,Portability,NSR
1291,system shall be installed in every employeeâs mobile phone device to monitor device apps and record activity on device,Functionality,NSR
1292,system shall enforce that all user login before they can access system,Authentication,NSR
1293,system shall ensure that sensitive information of transaction detail should be hashed in database in case of data breach,Confidentiality,NSR
1294,system shall be fast with only an acceptable lag when multiple task are being processed,Performance,NSR
1295,system shall have selfexplanatory user interface,Usability,NSR
1296,system shall analyse captured activity and then give notification to system administrator by uploading information on web,Functionality,NSR
1297,system shall be simple and userfriendly,Usability,NSR
1298,system shall enable system administrator to log on to website in order to view notification message,Authorization,NSR
1299,system shall be able to store transaction information,Functionality,NSR
1300,system shall ensure that public key is left open and accessible to public domain,Availability,NSR
1301,system shall have clutterfree interface with well labelled button and selection component,Usability,NSR
1302,system shall be expected to be responsive enough to show no perceived lag during file loading and information entry,Performance,NSR
1303,system shall process all input to produce wave audio file functionality,Functionality,NSR
1304,system shall generate and send periodic log to parentâs smartphone,Auditing,NSR
1305,systemâs hashing module shall use sha algorithm,Functionality,NSR
1306,system shall be transferable to another platform with ease,Portability,NSR
1307,system shall employ good coding principle like loose coupling of module for easy maintainance,Maintainability,NSR
1308,system shall ensure that hashing and extraction module are easy to use and have user manual incorporated in system,Functionality,NSR
1309,system shall be able to generate periodic log well collect and analyse data alerting parent whenever certain keywords are typed,Auditing,NSR
1310,systemâs main screen shall include help and static analysis tab,Functionality,NSR
1311,system shall be used by government official to bring relevant information to user unlike normal web search,Functionality,NSR
1312,system shall be reliably used on any device that meet hardware and software requirement stated,Portability,NSR
1313,system shall be scalable and able to handle growth in data flow leveraging twitter api capability,Maintainability,NSR
1314,database must be available,Availability,NSR
1315,system shall offer user authentication before any user is granted access to service,Authentication,NSR
1316,system shall be user friendly,Usability,NSR
1317,simplicity over enhanced and lucrative user interface to improve system response,User-Friendly,NSR
1318,direct option are provided so that user can easily perform required operation like adding descriptive diary,User-Friendly,NSR
1319,system shall be able to register wireless connection,Functionality,NSR
1320,interactive interface of application ha been designed in smart way that is helpfuleasy in using and doe not present user with complex path to follow,User-Friendly,NSR
1321,system shall lock automatically after connection is lost,Immunity,NSR
1322,system shall be able to make random check on connection,Performance,NSR
1323,system shall distribute authentic copy of each supplied video,Integrity,NSR
1324,technically this project is feasible it provides desired feature through all it component and processing their data,Feasibility,NSR
1325,system shall give each user who purchase copy of video lifetime access right to authentic copy video,Authorization,NSR
1326,proposed algorithm shall be able to be implemented by numerous legally operating online video,Portability,NSR
1327,system shall be easily integrated with available video player,Portability,NSR
1328,all included library and function are supported by android and firebase,Feasibility,NSR
1329,system shall enable virtual file to be deleted once client application is closed functionality,Functionality,NSR
1330,response time of system is another important factor in determining it efficiency,Performance,NSR
1331,costeffectiveness of system is an important consideration it determines feasibility of deploying system on larger scale,Feasibility,NSR
1332,laser fence system may be designed to be more mobile allowing for rapid deployment and repositioning needed,Scalability,NSR
1333,system server shall be able to generate unique transaction id after every purchase or free download,Functionality,NSR
1334,system shall ensure that user can only download if registered with server,Authorization,NSR
1335,this application designed will be accessible aroundtheclock,Availability,NSR
1336,our system should take second to run query and give answer,Performance,NSR
1337,system shall ensure wireless connection enables fast response time which is time it take for mobile phone and laptop to connect to access file,Performance,NSR
1338,system shall not affect operation of any application on laptop or mobile phone,Performance,NSR
1339,system shall be flexible and adapts to change,Maintainability,NSR
1340,system shall require agent to report detected image to agencyâs database,Functionality,NSR
1341,system shall be developed to be available all time,Availability,NSR
1342,system shall be able to be easily transfer from one hardware or software platform to another,Portability,NSR
1343,system shall be able to monitor network in realtime,Performance,NSR
1344,system shall provide visualisation in form of graph,Functionality,NSR
1345,system shall be maintainable it is built with three module with command that avoid violating coding principle,Maintainability,NSR
1346,system shall be able to sniff traffic to and from network in realtime,IntrusionD,NSR
1347,system service shall be accessible offline since it will be desktop application,Functionality,NSR
1348,system shall ensure that communication of agent and agency or server is such that only registered agent can report to agency,Authorization,NSR
1349,application is available for user all time provided mobile is in working sate and internet connection is available,Availability,NSR
1350,system shall offer high performance in time taken by agent on searching watermarked image collecting and processing report to agency,Performance,NSR
1351,system shall allow that once agent are being released they should be able to search watermarked image from host connected within network,Functionality,NSR
1352,user must be registered,Confidentiality,NSR
1353,program can handle huge number of image and object and is scalable,Scalability,NSR
1354,application is easy to use with simple and intuitive interface that requires minimal training,Usability,NSR
1355,application ha simple and intuitive interface that allows user to easily capture and upload image well submitting image for counting object,User-Friendly,NSR
1356,by adhering to accessibility guideline program is usable by all user including those with impairment,Confidentiality,NSR
1357,application doe not drain battery of user phone excessively ensuring that it can be used for longer period without need for frequent charging,Reliability,NSR
1358,application must be responsive,Performance,NSR
1359,if invalid attempt is made user must be prompted to relogin,Authentication,NSR
1360,if user is not registered then admin must register user,Authentication,NSR
1361,system shall provide two factor authentication,Authentication,NSR
1362,system shall provide guidance to how to operate and manoeuvre through it and produce wanted result,Usability,NSR
1363,no component should disturb input or output of other component or module,Confidentiality,NSR
1364,smart campus system solution is for all educational and training institute so it should work perfectly in different environment or institute it will execute same result and will work same in other institute,Portability,NSR
1365,system shall provide ease of use,Usability,NSR
1366,system shall retain record for all baby mother will have subsequently,Functionality,NSR
1367,progress report feature doe proper monitoring for progress of userâs mental health,Functionality,NSR
1368,this system provides ability to register mother who come to healthcare centre for first time,Functionality,NSR
1369,interface should be clear enough and simple to understand for it designated user,Usability,NSR
1370,chat box feature help user to directly communicate with therapist if needed,Functionality,NSR
1371,system shall limit typing for cost engineer or contractor through use of radio button and dropdown menu,Usability,NSR
1372,model should produce estimate very early ie it should be able to produce an estimate within very day you receive and feed requirement to it training process would have been done already,Performance,NSR
1373,timer feature provides counter clock of minute in which user ha to perform any exercise from recommended one,Functionality,NSR
1374,system shall be able to display final cost estimate for cost engineer,Functionality,NSR
1375,question round feature generates question form this is descriptive feedback where use responds back to system by answering different descriptive question,Functionality,NSR
1376,system shall be able to compute construction cost estimate based on data and feature fed by cost engineer,Functionality,NSR
1377,system shall be able to give cost engineer platform to add feature and necessary data about desired project,Functionality,NSR
1378,system shall be able to accept data from previous project for learning process,Functionality,NSR
1379,user interface should be easy to navigate and should be selfexplanatory,Usability,NSR
1380,user interface should be almost selfexplanatory,Usability,NSR
1381,referring to consult professional human therapist feature will work in case if user didnât find progress in mental health,Functionality,NSR
1382,simulator should be simple and user friendly,Usability,NSR
1383,system shall be able to randomize scene so that user can not predict next scene,Functionality,NSR
1384,system shall be able to save user profile of each user,Functionality,NSR
1385,system shall be able to simulate road rule diagram,Functionality,NSR
1386,system shall be able to calculate performance of each user,Functionality,NSR
1387,user interface should be easy to navigate and should be selfexplanatory,Usability,NSR
1388,user can share report with therapist for better consultation,Functionality,NSR
1389,career recommender should be simple and user friendly,Usability,NSR
1390,system shall register new baby and it detail linked to mother,Functionality,NSR
1391,system shall monitor babyâs growth,Functionality,NSR
1392,system should provide an interface that is easy to read state of affair from remote place for example in field or nursery,Usability,NSR
1393,report log feature provides two different option one is for daily report and one is for question round report,Functionality,NSR
1394,user interface shall be almost selfexplanatory,Usability,NSR
1395,system is able to provide user with required credentialsâl platform,Functionality,NSR
1396,system should be simple and user friendly,Functionality,NSR
1397,system shall be able to store transaction information,Functionality,NSR
1398,user and admin if logged into system must be able to logout of once they have performed activity,Functionality,NSR
1399,user and admin if logged in must be able to view log related to video in database,Functionality,NSR
1400,user and admin if logged in must be able to view log related to user in database,Functionality,NSR
1401,user and admin if logged in must be able to set their profile picture by selecting in picture in jpg or png format,Functionality,NSR
1402,system shall be able to predict fraudulent and nonfraudulent transaction in real time,Functionality,NSR
1403,system is user friendly and easy to navigate,Usability,NSR
1404,system is an efficient system that ha best operational performance relieving both nurse and mother of timeconsuming nature in provision of service in health facility,Performance,NSR
1405,system shall be easy to use and user friendly it is targeted at all mother both literate and illiterate,Usability,NSR
1406,admin must be able to create any new user of system,Functionality,NSR
1407,system in term of responsiveness is real time system such that client can easily access medical record of babyâs at any given point in time,Availability,NSR
1408,daily description box appears where user can write description about daily experience,Functionality,NSR
1409,on basis of key word certain emotion is picked from category of emotion,Functionality,NSR
1410,system can perform well in web environment catering for all mother nationwide without encountering major challenge,Portability,NSR
1411,dispatching mechanism will employ sm blog chat and email,Functionality,NSR
1412,suggestion feature link directly to some content saved in database but is accessed online,Functionality,NSR
1413,this system will provide user with notification on account information update scheduled review date disease outbreak health practitioner advice and hint on practicing proper baby health care,Functionality,NSR
1414,system shall allow monitoring of growth and healthcare issue pertaining to baby and it mother,Functionality,NSR
1415,system shall allow user to view progress of baby from birth to postnatal visit,Functionality,NSR
1416,system shall allow user to view mother or baby detail to add new information and update record,Functionality,NSR
1417,system shall be able to allow student to view recommended career for them,Functionality,NSR
1418,system shall be able to allow student to view final result and degree class,Functionality,NSR
1419,system shall be able to allow lecturer to add studentsâ final mark,Functionality,NSR
1420,system shall allow creation of user administrator lecturer student account,Functionality,NSR
1421,software will undergo all type of testing like performance testing stress testing and many others,Performance,NSR
1422,user will be able to upload image via camera of smartphone,Functionality,NSR
1423,capacity to do thing right will depend on monitoring task definition,Functionality,NSR
1424,system doe not continuously interact with database it doe seek student information from university database only when administrator request,Functionality,NSR
1425,user will be able to upload image from gallery of smartphone,Functionality,NSR
1426,software depends on operating system speed and efficiency in it execution,Performance,NSR
1427,user will be able to pick select image from gallery,Functionality,NSR
1428,software will work long server upon which it is installed in running there are no time limit to using software however it is also possible to stop software from running should there be need,Functionality,NSR
1429,system shall allow time to fetch student detail from database to be second to be tested during developmentâ,Performance,NSR
1430,system shall allow background process to be monitoring for any scan and relaying information to registry about any unusual activity,IntrusionD,NSR
1431,system shall allow user to generate monthly report which can be viewed by network admin when necessary,Functionality,NSR
1432,this feature work on system defined query ie user english language phrase and return them command for that specific query,Functionality,NSR
1433,system shall allow user to check with student laptop and university pc register and search for device matching rogue node and corresponding student and student personal detail,Functionality,NSR
1434,every input input and returned output of system will be remotely accessed at backend server of system,Functionality,NSR
1435,history feature allows user to maintain their history of all search they made and are executed on system,Functionality,NSR
1436,console interaction feature allows user to have terminalbased interaction console screen with system,Functionality,NSR
1437,system shall allow user to logout,Functionality,NSR
1438,system shall allow user to type english language phrase,Functionality,NSR
1439,system shall provide list recommended command to help user,Functionality,NSR
1440,system shall allow user to be able to remotely access website application server,Functionality,NSR
1441,system shall allow user to recover unique identifier of node which wa used to generate nodeâs unique idfingerprint upon registration when owner enteredjoined university with it,Auditing,NSR
1442,system shall allow user to access all hisher typed query,Functionality,NSR
1443,system shall provide console screen to user where they get result of query they typed,Functionality,NSR
1444,when user click on about disease it will be routed to about disease,Functionality,NSR
1445,product can be corrected by update patch and with newer version when required,Maintainability,NSR
1446,hid is designed to work on window platform from window and any later version of window but software need some adjustment for it to work on linux platform,Portability,NSR
1447,system shall provision good quality online service making it easy to use since an upfront user interface will be delivered,Usability,NSR
1448,human therapist feature provides some already embedded professional on application so that user can directly consult with himher and share their case,Functionality,NSR
1449,userâs availability feature show available user to therapist,Functionality,NSR
1450,system show text box for enter information,Functionality,NSR
1451,system user interface should be almost selfexplanatory,Usability,NSR
1452,system shall allow file type filtering to avoid overloading of normal flow information with unnecessary file,Immunity,NSR
1453,system should be simple and user friendly,Usability,NSR
1454,system shall be able to autonomously schedule irrigation without farmer input,Functionality,NSR
1455,system shall be able to save water by reducing water applied to plant,Functionality,NSR
1456,system shall be able to control water pump for application of water to crop being irrigated,Functionality,NSR
1457,system shall be able to calculate maximum soil water deficit,Functionality,NSR
1458,framework ought to be accessible wherever it is required at whatever point client need to make purchase,Availability,NSR
1459,software is delivered with user manual and once installed software is easy to run,Usability,NSR
1460,control panel also known console is user interface for id,Functionality,NSR
1461,framework should exhibit high rate of work handling and that of administrationsâ client,Performance,NSR
1462,system shall offer high throughput which is yield in respect to measure of going through framework from contribution to yield,Performance,NSR
1463,systemâs time to react to tolerating exchange to happen or dismissing it hindering card and cautioning head be brief in order to advance an easy to understand framework,Performance,NSR
1464,laser fencing can provide continuous monitoring and detecting capability,Functionality,NSR
1465,when user open application welcome screen will be displayed,Functionality,NSR
1466,system shall allow buying pattern of purchase to be analyzed,Functionality,NSR
1467,system shall allow debitcredit card to be activated,Functionality,NSR
1468,main page of app will be home page where user will see two main option upload image using camera or using gallery,Functionality,NSR
1469,when user click on home remedy it will be routed to home remedy page,Functionality,NSR
1470,system should provide functionality to allow user to view and read temperature humidity and soil moisture content state of plant from nursery stage up to harvesting,Functionality,NSR
1471,system is able to create user account,Functionality,NSR
1472,system shall provide short response time on service offered,Performance,NSR
1473,system operation shall be fast both in capturing detail and retrieving data,Performance,NSR
1474,system shall allow that number of patient record increase with time and capacity of system to hold these record must also increase record increase,Maintainability,NSR
1475,system should be easy to use and understand,Usability,NSR
1476,system shall ensure that nontechnical user like medical practitioner can interact with it with easy,Usability,NSR
1477,it should have userfriendly interface,User-Friendly,NSR
1478,system shall allow data input into system to be encrypted before being sent to database instance on our cloud server for storage,Confidentiality,NSR
1479,system shall enable user such medical practitioner to enter data into system,Functionality,NSR
1480,system shall notify administrator of who access system in case data breach occurs,Auditing,NSR
1481,system shall apply realtime monitoring of data being accessed,Performance,NSR
1482,system shall allow administrator to assign role to user,Authorization,NSR
1483,conduct user testing and ensure that user can easily use and navigate system,Usability,NSR
1484,smart contract issue token based on erc interface for ethereum blockchain,Functionality,NSR
1485,blockchain land registry system smart contract store data,Functionality,NSR
1486,system user interface shall communicate with blockchain land registry smart contract using webjs,Functionality,NSR
1487,transaction data is validated by smart contract,Authentication,NSR
1488,system should be easy to update and maintain system should have wellorganized and documented code,Maintainability,NSR
1489,system shall create transaction sent to ethereum protocol,Functionality,NSR
1490,system shall communicate with django api to get corresponding ethereum address of entered national id,Functionality,NSR
1491,system shall allow council to select location on google map or manually enter coordinate of location of stand,Functionality,NSR
1492,system shall allow capturing of stand detail such location district ward and stand number,Functionality,NSR
1493,system shall allow capturing of national id for person stand is issued to,Functionality,NSR
1494,system shall use simple to understand command for user operation and same will apply to querying and editing segment,Usability,NSR
1495,system should be able to work with different type of input device,Adaptability,NSR
1496,test system on different operating system and hardware configuration and ensure that it can work with different type of input device,Adaptability,NSR
1497,test system for stability and ensure that it can handle different type of user input without crashing or freezing,Reliability,NSR
1498,system should not crash or freeze during use it should be able to handle different type of user input,Reliability,NSR
1499,system should keep record of time and date to facilitate data analytics,Functionality,NSR
1500,test system for response time and ensure that there is no noticeable delay in mouse movement,Performance,NSR
1501,this can be measured in term of ease of use,Usability,NSR
1502,admin side panel or application interface must be user friendly,User-Friendly,NSR
1503,there must be no complexity in system usability,Usability,NSR
1504,smart campus project should be correct in term of it functionality calculation used internally and navigation should be correct,Accuracy,NSR
1505,system shall allow user to download file when they want to use them upon answering correctly randomly generated question from their profile,Authentication,NSR
1506,system shall allow user to upload data file of any type to their cloud account with description of not le than word,Functionality,NSR
1507,system shall allow people to connect to their account after they initially register with system and sign in to access it,Authorization,NSR
1508,system shall allow user to create cloud account,Functionality,NSR
1509,should be flexible enough to modify adaptable to other product with which it need interaction,Adaptability,NSR
1510,should be easy to interface with other standard rd party component,User-Friendly,NSR
1511,system shall process video footage in reasonable time,Performance,NSR
1512,software reuse is good costefficient and timesaving development method,Accuracy,NSR
1513,system shall allow new system administrator to be able to use it without steep learning curve,Usability,NSR
1514,divide application into different module so that module can be reused across application,Accuracy,NSR
1515,interoperability of one system to another should be easy for product to exchange data or service with other system,Confidentiality,NSR
1516,different system module should work on different operating system platform different database and protocol condition,Confidentiality,NSR
1517,system shall enable loading feeding video file for processing into system,Functionality,NSR
1518,system shall allow administrator to log in to access system,Authentication,NSR
1519,system log data shall be maintained without burdening user,Performance,NSR
1520,system shall maintain audit log,Auditing,NSR
1521,system shall be deployed over cloud and accessible both on web and mobile platform for portability,Portability,NSR
1522,system should respond to user input in timely manner it should not experience any significant delay in mouse movement,Performance,NSR
1523,system shall ensure that system record shall be encrypted and stored in cloud cyphertext,Confidentiality,NSR
1524,design of application will try to focus on simplicity to make it simple possible for user to use,User-Friendly,NSR
1525,product should be scaled according to framework of working of organization,Performance,NSR
1526,user should be able to use it at same time without lagging due to multiple user,Performance,NSR
