Sno.,Requirements,Multi_Class,NewClass
1940,staff member shall have ability to manage progress of part time student which includes modifying their sequence of class and timeline of class,Functionality,NSR
1941,system shall be able to display printable summary for individual cohort which will include student enlisted program of study sequence of class cohort progress through program and timeline of completion,Functionality,NSR
1942,system shall be able to display printable summary for individual clinical lab which will include but not be limited to class name class number lab section listing of student enrolled instructor day time and location,Functionality,NSR
1943,system will notify affected party when change occur affecting class including but not limited to class cancellation class section detail change and change to class offering for given quarter,Functionality,NSR
1944,system shall be able to display printable summary for individual nursing student which will include but not be limited to student name student id admission date class credit gpa and cohort that student is enrolled in,Functionality,NSR
1945,system shall be able to display printable summary of system log,Functionality,NSR
1946,system shall contain contact information email and phone number for all people relevant to system including but not limited to staff member student lecture instructor clinical lab instructor and clinical site administrator,Functionality,NSR
1947,system will use stored email address primary mean of communicating information to affected party,Functionality,NSR
1948,system will notify affected party for routine communication purpose including but not limited to informing student of upcoming offered class timeline and what their schedule will beshall be,Functionality,NSR
1949,system will notify affected party when change occur affecting clinicals including but not limited to clinical section capacity change and clinical section cancellation,Functionality,NSR
1950,system shall achieve up time,Availability,NSR
1951,system shall be available for use between hour of am and pm,Availability,NSR
1952,response time of general student management task shall take no longer than second and response time of schedule generation shall take no longer than second,Performance,NSR
1953,search result shall be returned no later second after user ha entered search criterion,Performance,NSR
1954,system shall offer display of all event in exercise,Functionality,NSR
1955,system shall filter data by venue and key event,Functionality,NSR
1956,system shall allow user to define time segment,Functionality,NSR
1957,system shall display local and exercise time in separate clock,Functionality,NSR
1958,system shall offer ability to pause and resume refresh of data,Functionality,NSR
1959,system shall provide chart for activity or event actual versus assumed time,Functionality,NSR
1960,system shall provide history report of change made to activity or event data,Functionality,NSR
1961,look and feel of system shall conform to user interface standard of smart device,User-Friendly,NSR
1962,user interface shall have standard menu button for navigation,User-Friendly,NSR
1963,system shall have professional appearance,User-Friendly,NSR
1964,product shall have consistent color scheme and font,User-Friendly,NSR
1965,system shall be used by realtor with no training,Usability,NSR
1966,system shall be intuitive and self explanatory,Usability,NSR
1967,product shall be easy for realtor to learn,Usability,NSR
1968,product shall use symbol and word that are naturally understandable by realtor community,Usability,NSR
1969,system shall allow modification of display,Functionality,NSR
1970,system shall link event back to either sync matrix or exercise managment tool application for modification,Functionality,NSR
1971,system shall display data from sync matrix and exercise management tool application,Functionality,NSR
1972,system shall display event in vertical table by time,Functionality,NSR
1973,if projected data must be readable on x projection screen of viewer must be able to read event activity data from viewing distance of,Usability,NSR
1974,product shall be available during normal business hour long user ha access to client pc system will be available of time during first six month of operation,Availability,NSR
1975,if projected data must be understandable on x projection screen of viewer must be able to determine that event or activity are occuring in current time from viewing distance of,Usability,NSR
1976,product shall be intuitive and selfexplanatory of new user shall be able to start display of event or activity within minute of using product,Usability,NSR
1977,product shall respond fast to keep uptodate data in display,Performance,NSR
1978,system shall have mdi form that allows for viewing of graph and data table,Functionality,NSR
1979,system shall display event in graph by time,Functionality,NSR
1980,system shall color code event according to their variance from current time,Functionality,NSR
1981,system shall display event or activity,Functionality,NSR
1982,display shall have two region left of display is graphical right of display is data table,Functionality,NSR
1983,data displayed in both node within graph and row in table are msel summary data,Functionality,NSR
1984,table side of display shall be split into region sequential and temporal,Functionality,NSR
1985,top of table will hold event that are to occur sequentially,Functionality,NSR
1986,bottom of table will hold event that occur according to it relevance to current time,Functionality,NSR
1987,product shall produce search result in an acceptable time,Performance,NSR
1988,product shall generate cma report in an acceptable time,Performance,NSR
1989,staff member shall be able to complete set of task in timely manner,Performance,NSR
1990,cma report shall be returned no later second after user ha entered cma report criterion,Performance,NSR
1991,system shall update or create new property listing in ml,Functionality,NSR
1992,realtor shall be able to generate cma report based on property criterion,Functionality,NSR
1993,system shall be able to call seller or buyer to schedule an appointment,Functionality,NSR
1994,realtor shall be notified of new client appointment after automatic synchronization with office system,Functionality,NSR
1995,realtor shall be able to retrieve map showing property location for specified area,Functionality,NSR
1996,system shall notify realtor when seller or buyer responds to an appointment request,Functionality,NSR
1997,product shall allow user to save property search result,Functionality,NSR
1998,system shall be easy to use by program administratorsnursing staff member,Usability,NSR
1999,all of user shall be able to use system after one day of training,Usability,NSR
2000,system shall help user avoid making mistake while scheduling class and clinicals for nursing student,Usability,NSR
2001,number of mistake noted by student shall be decreased by in first year,Usability,NSR
2002,system shall be intuitive to program administratorsnursing staff member,Usability,NSR
2003,out of program administratorsnursing staff member shall successfully be able to use system to manage scheduling of class and clinicals,Usability,NSR
2004,system shall use symbol and word that are naturally understandable by user community,Usability,NSR
2005,verbiage used within system shall be consistent with standard english and terminology of national nursing community,Usability,NSR
2006,system shall display clear property image in search result,Functionality,NSR
2007,user shall be able to download appointment and contact information for client,Functionality,NSR
2008,user shall be able to get driving direction to selected property,Functionality,NSR
2009,of saved user preference shall be restored when system come back online,Fault Tolerance,NSR
2010,product shall synchronize contact and appointment in an acceptable time,Performance,NSR
2011,product shall synchronize with office system every hour,Performance,NSR
2012,product shall be available for use hour per day day per year,Availability,NSR
2013,out of access to system system is available time,Availability,NSR
2014,product shall operate in offline mode whenever internet connection is unavailable,Fault Tolerance,NSR
2015,product shall allow user to view previously downloaded search result cma report and appointment,Fault Tolerance,NSR
2016,product shall be able to support multiple remote user,Scalability,NSR
2017,system shall allow real estate agent to query ml information,Functionality,NSR
2018,product shall be able support simultaneous user,Scalability,NSR
2019,product shall be capable of handling existing user this number is expected to grow time within next year,Scalability,NSR
2020,product shall be installed by an untrained realtor without recourse to separatelyprinted instruction,Usability,NSR
2021,of untrained realtor shall be able to install product on their device without printed instruction,Usability,NSR
2022,product is expected to run on window ce and palm operating system,Portability,NSR
2023,only registered realtor shall be able to access system,Confidentiality,NSR
2024,dispute application shall interface with cardmember posting and billing system this will allow dispute application to request adjustment to cardmember and merchant account all adjustment request must be sent to cardmember posting and billing system,Operational,NSR
2025,only user with update access must be able to initiate dispute request,Confidentiality,NSR
2026,product shall update existing conference room,Functionality,NSR
2027,current repair facility rating shall be displayed to user,Functionality,NSR
2028,user shall enter new rating based on audit report,Functionality,NSR
2029,rating shall be from scale of,Functionality,NSR
2030,rating shall include category for attempted use of recycled part and actual use of recycled part,Functionality,NSR
2031,user shall select to save preferred repair facility rating,Functionality,NSR
2032,preferred repair facility rating shall be saved by system,Functionality,NSR
2033,product must work with most database management system dbms on market whether dbms is colocated with product on same machine or is located on different machine on computer network,Operational,NSR
2034,product will function alongside server software on any operating system where java runtime can be installed,Operational,NSR
2035,product will require collaboration with database management system dbms dbms may be located on same machine product or on separate machine residing on same computer network,Operational,NSR
2036,product must make use of webapplication server technology open source example include apache web server tomcat and jboss application server,Operational,NSR
2037,database management system such oracle db mysql or hsql will need to be integrated with product,Operational,NSR
2038,product look and feel shall be able to incorporate aspect of customer organization such logo branding and identity,User-Friendly,NSR
2039,product shall have conservative and professional appearance,User-Friendly,NSR
2040,product shall make user want to use it of user surveyed report they are regularly using product after first week postlaunch,Usability,NSR
2041,product shall be easy to use of user will be able to successfully reserve conference room within minute of product use,Usability,NSR
2042,product shall allow user to select chosen language from one of target market country,Usability,NSR
2043,system will display blank set of rating if there are not rating yet defined,Functionality,NSR
2044,user shall select to view preferred repair facility rating,Functionality,NSR
2045,dispute system shall generate user report that detail any new user that have been added and any change to an existing user access level report will be reviewed for auditing purpose,Confidentiality,NSR
2046,audit report shall be available to other adjuster at later point in time,Functionality,NSR
2047,system shall search for available recycled part for supplied vehicle part and supplier,Functionality,NSR
2048,estimator shall search by zipcode with radius of mile if no part are found for preferred part supplier,Functionality,NSR
2049,system shall retain available recycled part and supplier returned from search,Functionality,NSR
2050,available recycled part information and their supplier shall be returned to user,Functionality,NSR
2051,estimator shall apply selected recycled part to collision estimate,Functionality,NSR
2052,estimator shall not apply recycled part to collision estimate if no available part are returned,Functionality,NSR
2053,adjuster shall review collision estimate,Functionality,NSR
2054,adjuster shall request recycled part audit of collision estimate,Functionality,NSR
2055,recycled part search result provided to estimator shall be retrieved by system,Functionality,NSR
2056,system shall generate an audit report based on available recycled part and collision estimate,Functionality,NSR
2057,audit report shall include total number of recycled part used in estimate,Functionality,NSR
2058,audit report shall include number of available recycled part from original search result,Functionality,NSR
2059,audit report shall include percentage of available recycled part used in estimate,Functionality,NSR
2060,audit report shall include total score of audit which sum indivual line item,Functionality,NSR
2061,audit report shall be displayed to user,Functionality,NSR
2062,product shall allow for customization of start page and view preference,Usability,NSR
2063,an employee will be able to successfully use product within few minute after informally navigating product for le than minute user shall be able to successfully setup meeting and reserve conference room,Usability,NSR
2064,product shall use standard navigation menu familiar to most web user,Usability,NSR
2065,product shall allow for intuitive searching of available conference room,Usability,NSR
2066,product is expected to integrate with multiple database management system product will operate with oracle sql server db mysql hsql and m access,Operational,NSR
2067,product shall be able to be installed in any operating environment within day,Operational,NSR
2068,product shall ensure that only company employee or external user with companyapproved user id may have product access of all logons shall be by either company employee or external user with companyapproved user id,Confidentiality,NSR
2069,only manager are able to perform search query for reservation by user of all search query for reservation by user shall be from logons of only management logons,Confidentiality,NSR
2070,product shall ensure that database data corresponds to data entered by user each conference room reservation in system will contain same information wa entered by user,Confidentiality,NSR
2071,product shall have ability to receive automatic software update new threat emerge of customer will be able to receive automatic software update transmitted to installed product,Confidentiality,NSR
2072,language of product shall accommodate all of target market country of survey respondent from each target market country will find that language of product is acceptable,Scalability,NSR
2073,product shall be able to display calendar date and time according to user locale of survey respondent from each target market country will find that date and time formatting of product is correct,Usability,NSR
2074,product must be developed with jsejee programming language library,Operational,NSR
2075,product shall record meeting entry,Functionality,NSR
2076,product will notify employee of meeting invitation,Functionality,NSR
2077,product shall have ability to send meeting reminder to employee,Functionality,NSR
2078,product shall assign organizer contact information to each meeting they create,Functionality,NSR
2079,product will record meeting acknowledgement,Functionality,NSR
2080,product shall store new conference room,Functionality,NSR
2081,product shall be translated into foreign language other than target market country language in future release for each emerging target market it shall take no more than day to configure product for that market language,Usability,NSR
2082,customer shall be able to easily integrate new building map with product throughout product lifecycle integration of new map with product shall be possible with little to no support from product support staff,Maintainability,NSR
2083,every registered user will have access to product support site via internet of registered user shall find solution to their problem within minute of using support site,Usability,NSR
2084,product shall be used in office environment,Operational,NSR
2085,product shall conform to american with disability act,Usability,NSR
2086,response shall be fast enough to avoid interrupting user flow of thought of task shall complete within second of task shall complete within second,Performance,NSR
2087,product shall create an exception log of problem encountered within product for transmission to our company for analysis and resolution,Fault Tolerance,NSR
2088,product shall be capable of handling up to concurrent request this number will increase to by release concurrency capacity must be able to handle peak scheduling time such early morning and late afternoon hour,Scalability,NSR
2089,product shall be able to process transaction per hour within two year of it launch this number will increase to by release,Scalability,NSR
2090,product shall be expected to operate for at least year for each customer installation,Scalability,NSR
2091,product must be able to interface with any html browser product shall transmit data between user and product without problem product shall display html properly in of all html browser tested minimum is to test browser,Operational,NSR
2092,product must be highly configurable for use with various database management system for end user of end user are able to integrate new database management system with product without changing product software code,Maintainability,NSR
2093,product must be able to interface with various database management system product shall communicate successfully with database management system on of all transaction,Operational,NSR
2094,product must be able to interface with various email server product shall be able to send email,Operational,NSR
2095,product shall be available for distribution via internet binary or zip file,Operational,NSR
2096,product shall be available for distribution packaged cd,Operational,NSR
2097,product will be available for licensing oneserver twofive server or fiveormore server license,Operational,NSR
2098,new user must be able to be added to system within minute of new user are able to log into system within minute,Usability,NSR
2099,estimator shall search for available recycled part using list of preferred part supplier,Functionality,NSR
2100,estimator shall search for available recycled part using damaged vehicle part information,Functionality,NSR
2101,system shall return list of repair facility within radius if preferred repair facility can not be determined,Functionality,NSR
2102,product shall comply with corporate user interface guideline,User-Friendly,NSR
2103,dispute system must provide confirmation to user upon creation of ticket retrieval request that contains following information dispute case number type of retrieval requested copy original or portfolio and date that merchant response is due,Functionality,NSR
2104,dispute system must provide confirmation to user upon creation of chargeback request confirmation must contain following information dispute case number type of chargeback requested pending or immediate and date that merchant response is due,Functionality,NSR
2105,dispute system must provide ability to view existing dispute case,Functionality,NSR
2106,dispute system must provide search functionality search method must include ability to search by dispute case number merchant account number cardmember account number and issuer number in addition to above criterion search functionality must further allow user to limit result of search by date range type of dispute ticket retrieval request or chargeback notification case status open closed or all and dispute reason code,Functionality,NSR
2107,list of all dispute case that meet entered search criterion must be provided to user list of case must differentiate type andor status of case by color coding line item in list for example all open case will be yellow and all closed case will be gray,Functionality,NSR
2108,dispute system shall provide user ability to view history of all activity that have occurred on dispute case,Functionality,NSR
2109,dispute system shall provide user with ability to follow up on dispute case via followup action list of available follow up action for given dispute case must be filtered by status of case and access level of user,Functionality,NSR
2110,dispute system shall record name of user and date for any activity that creates or modifies dispute case in system detailed history of action taken on case including date and user that performed action must be maintained for auditing purpose,Functionality,NSR
2111,for any systematic nonuser initiated action that occurs on case such dispute aging process case activity will be generated upon next logon user that initiated dispute case must be notified that systematic action ha occurred on dispute case,Functionality,NSR
2112,all letter request must be formatted according to guideline specified by print letter utility system,Functionality,NSR
2113,any dispute case that have been closed for over month must be purged from online dispute database,Functionality,NSR
2114,product must support internet explorer and above,Operational,NSR
2115,product must support mozilla firefox and above,Operational,NSR
2116,product shall interface with choice part system this provides feed of recycled part data,Operational,NSR
2117,product shall run on existing hardware for all environment,Operational,NSR
2118,dispute system must allow user to create three unique type of ticket retrieval request three type of ticket retrieval request are request for original receipt request for copy of receipt or request for portfolio portfolio consists of documentation that would provide proof of purchase such documentation that is received from car rental agency that is more than sale receipt,Functionality,NSR
2119,dispute system will provide user ability to create or initiate ticket retrieval request part of ticket retrieval creation process system must prompt user to enter all required information to create ticket retrieval request ticket retrieval request is document that is sent to merchant inquiring validity of transaction,Functionality,NSR
2120,dispute system must provide user ability to initiate single dispute case on multiple transaction that belong to single merchant,Functionality,NSR
2121,all business rule specified in dispute system shall be in compliance with merchant operating regulation,Legal,NSR
2122,all addition of new user and modification to user access shall be recorded on user report,Confidentiality,NSR
2123,if user account is revoked it can only be reinstantiated by system administrator,Confidentiality,NSR
2124,only system administrator shall be able to reset revoked user logon account,Confidentiality,NSR
2125,dispute application shall manipulate and view business data user will not have direct access to data file or database,Confidentiality,NSR
2126,all update to data file or database must be initiated from dispute system,Confidentiality,NSR
2127,dispute application must conform to legal requirement specified by merchant operating regulation,Legal,NSR
2128,dispute application must conform to legal requirement specified by regulation e and regulation z that govern credit card dispute processing,Legal,NSR
2129,dispute system must allow user to select disputable transaction based on age of transaction from user interface and initiate dispute ticket retrieval request or chargeback notification on selected transaction,Functionality,NSR
2130,all business rule specified in dispute system shall be in compliance to guideline of regulation e and regulation z,Legal,NSR
2131,dispute application must maintain detailed history of every action that user take on dispute case this ensures complete audit trail if question arise later on with regard to particular dispute case,Legal,NSR
2132,all action that modify an existing dispute case must be recorded in case history,Legal,NSR
2133,dispute system must be accessible by both internal and external user,Functionality,NSR
2134,dispute system will facilitate direct data entry of dispute case via user interface that support real time response to user,Functionality,NSR
2135,dispute system must provide different level of access with regard to dispute case initiation and followup action,Functionality,NSR
2136,product shall adhere to corporate architecture guideline,Operational,NSR
2137,product shall comply with corporate color scheme,User-Friendly,NSR
2138,preferred repair facility shall be returned to user,Functionality,NSR
2139,appearance of product shall appear professional,User-Friendly,NSR
2140,only adjuster can request recycled part audit report no user without an adjuster role shall request recycled part audit,Confidentiality,NSR
2141,only adjuster with supervisor role can update preferred repair facility rating user without supervisor role can not access repair facility rating,Confidentiality,NSR
2142,only collision estimator shall search for recycled part user without collision estimator role shall not have access to search for recycled part,Confidentiality,NSR
